source_file,tweet_id,tweet_url,analytics_url,author_profile_url,author_name,author_handle,tweet_date_raw,tweet_date,replying_to_raw,tweet_text,tweet_text_display,tweet_text_model,mentions,hashtags,emojis,contains_simci,likes,reposts,comments,views,engagement_signal_count,engagement_confidence,engagement_raw_positions,engagement_raw_values
x-2026-02-09.csv,1702162867334574208,https://x.com/Cesar8993/status/1702162867334574208,https://x.com/Cesar8993/status/1702162867334574208/analytics,https://x.com/Cesar8993,Julio Cesar Reyes,@Cesar8993,"Sep 13, 2023",2023-09-13,,"@IreneVelezT Este remedo de acaba de decir q se han incautado cerca de 300.000.000.000 Kg de cocaina en lo q va del año @DanielSamperO Según el #GobiernoDeLaMentira, sobre estos años la producción TOTAL es de 1.400.000 Kg/año, y este man incauta más de lo q producen This post is unavailable. SIMCI 😅 🤦🏻‍♂️","@IreneVelezT Este remedo de acaba de decir q se han incautado cerca de 300.000.000.000 Kg de cocaina en lo q va del año @DanielSamperO Según el #GobiernoDeLaMentira, sobre estos años la producción TOTAL es de 1.400.000 Kg/año, y este man incauta más de lo q producen This post is unavailable. SIMCI 😅 🤦🏻‍♂️","Este remedo de acaba de decir q se han incautado cerca de 300.000.000.000 Kg de cocaina en lo q va del año Según el GobiernoDeLaMentira, sobre estos años la producción TOTAL es de 1.400.000 Kg/año, y este man incauta más de lo q producen This post is unavailable. SIMCI ‍ ️",@DanielSamperO|@IreneVelezT,#GobiernoDeLaMentira,😅🤦🏻‍♂️,True,1,0,0,34,1,low,col_19,1
x-2026-02-09.csv,1702094831223443888,https://x.com/InSightCrime_es/status/1702094831223443888,https://x.com/InSightCrime_es/status/1702094831223443888/analytics,https://x.com/InSightCrime_es,InSight Crime Español,@InSightCrime_es,"Sep 13, 2023",2023-09-13,,"#Colombia | Putumayo es, por segundo año consecutivo, el departamento con más cultivos de coca, según el último informe del Sistema Integrado de Monitoreo de Cultivos Ilícitos,. ¿Qué factores explican el aumento consistente de cultivos ilícitos en el departamento? #SIMCI","#Colombia | Putumayo es, por segundo año consecutivo, el departamento con más cultivos de coca, según el último informe del Sistema Integrado de Monitoreo de Cultivos Ilícitos,. ¿Qué factores explican el aumento consistente de cultivos ilícitos en el departamento? #SIMCI","Colombia Putumayo es, por segundo año consecutivo, el departamento con más cultivos de coca, según el último informe del Sistema Integrado de Monitoreo de Cultivos Ilícitos,. ¿Qué factores explican el aumento consistente de cultivos ilícitos en el departamento? SIMCI",,#Colombia|#SIMCI,,True,3,2,1,842,3,high,"col_19,col_31,col_32","1,2,3"
x-2026-02-09.csv,1702034411427086541,https://x.com/CuartoDeHoraCol/status/1702034411427086541,https://x.com/CuartoDeHoraCol/status/1702034411427086541/analytics,https://x.com/CuartoDeHoraCol,Cuarto de Hora,@CuartoDeHoraCol,"Sep 13, 2023",2023-09-13,,#LoÚltimo | Un reciente informe del Sistema Integrado de Monitoreo de Cultivos Ilícitos ( ) reveló un cambio lineal en la tendencia de crecimiento de los cultivos ilícitos en Colombia. Simci 🚨,#LoÚltimo | Un reciente informe del Sistema Integrado de Monitoreo de Cultivos Ilícitos ( ) reveló un cambio lineal en la tendencia de crecimiento de los cultivos ilícitos en Colombia. Simci 🚨,LoÚltimo Un reciente informe del Sistema Integrado de Monitoreo de Cultivos Ilícitos ( ) reveló un cambio lineal en la tendencia de crecimiento de los cultivos ilícitos en Colombia. Simci,,#LoÚltimo,🚨,True,12,3,0,670,2,medium,"col_19,col_31","3,12"
x-2026-02-09.csv,1702028967350268132,https://x.com/hurtvillac/status/1702028967350268132,https://x.com/hurtvillac/status/1702028967350268132/analytics,https://x.com/hurtvillac,Jose Luis Hurtado V,@hurtvillac,"Sep 13, 2023",2023-09-13,,"Según el informe anual del Sistema Integrado de Monitoreo de Cultivos Ilícitos de Naciones Unidas ( ), Colombia ha alcanzado cifras nunca antes vistas en el cultivo de coca, con 230 mil hectáreas. La producción potencial de cocaína aumentó un 24%, hasta 1 mil 738 toneladas. Simci","Según el informe anual del Sistema Integrado de Monitoreo de Cultivos Ilícitos de Naciones Unidas ( ), Colombia ha alcanzado cifras nunca antes vistas en el cultivo de coca, con 230 mil hectáreas. La producción potencial de cocaína aumentó un 24%, hasta 1 mil 738 toneladas. Simci","Según el informe anual del Sistema Integrado de Monitoreo de Cultivos Ilícitos de Naciones Unidas ( ), Colombia ha alcanzado cifras nunca antes vistas en el cultivo de coca, con 230 mil hectáreas. La producción potencial de cocaína aumentó un 24%, hasta 1 mil 738 toneladas. Simci",,,,True,0,0,0,59,0,none,,
x-2026-02-08.csv,1701957105513628025,https://x.com/ElisaMontoyaOb/status/1701957105513628025,https://x.com/ElisaMontoyaOb/status/1701957105513628025/analytics,https://x.com/ElisaMontoyaOb,Elisa Montoya,@ElisaMontoyaOb,"Sep 13, 2023",2023-09-13,Replying to @ElisaMontoyaOb,@ElisaMontoyaOb Link del informe completo del: SIMCI 💡,@ElisaMontoyaOb Link del informe completo del: SIMCI 💡,Link del informe completo del: SIMCI,@ElisaMontoyaOb,,💡,True,3,1,0,332,2,medium,"col_18,col_29","1,3"
x-2026-02-09.csv,1701773942992650579,https://x.com/LaJornadaBC/status/1701773942992650579,https://x.com/LaJornadaBC/status/1701773942992650579/analytics,https://x.com/LaJornadaBC,La Jornada Baja California,@LaJornadaBC,"Sep 12, 2023",2023-09-12,,"#Opinión El divulgó ayer un informe, según el cual #Colombia se mantiene como el país donde se cultiva más hoja de coca y se produce más #cocaína Simci","#Opinión El divulgó ayer un informe, según el cual #Colombia se mantiene como el país donde se cultiva más hoja de coca y se produce más #cocaína Simci","Opinión El divulgó ayer un informe, según el cual Colombia se mantiene como el país donde se cultiva más hoja de coca y se produce más cocaína Simci",,#Colombia|#Opinión|#cocaína,,True,0,0,0,46,0,none,,
x-2026-02-09.csv,1701735887476854920,https://x.com/webmasnoticias/status/1701735887476854920,https://x.com/webmasnoticias/status/1701735887476854920/analytics,https://x.com/webmasnoticias,más+noticias,@webmasnoticias,"Sep 12, 2023",2023-09-12,,Informe de monitoreo del destaca que el narcotráfico está cambiado de estrategia: de áreas sembradas dispersas pasó a incrementar su productividad en regiones definidas. Simci,Informe de monitoreo del destaca que el narcotráfico está cambiado de estrategia: de áreas sembradas dispersas pasó a incrementar su productividad en regiones definidas. Simci,Informe de monitoreo del destaca que el narcotráfico está cambiado de estrategia: de áreas sembradas dispersas pasó a incrementar su productividad en regiones definidas. Simci,,,,True,1,1,0,7,2,medium,"col_19,col_31","1,1"
x-2026-02-09.csv,1701705769073484176,https://x.com/ExtrategiaPress/status/1701705769073484176,https://x.com/ExtrategiaPress/status/1701705769073484176/analytics,https://x.com/ExtrategiaPress,Extrategia Medios,@ExtrategiaPress,"Sep 12, 2023",2023-09-12,,"El informe resiente del de la Unodc, ha expuesto una alarmante cifra para Colombia en el año 2022: 230.000 hectáreas de coca sembradas en el país. Noticia completa en el siguiente link Abrimos hilo Simci ➡ 👉 🧵","El informe resiente del de la Unodc, ha expuesto una alarmante cifra para Colombia en el año 2022: 230.000 hectáreas de coca sembradas en el país. Noticia completa en el siguiente link Abrimos hilo Simci ➡ 👉 🧵","El informe resiente del de la Unodc, ha expuesto una alarmante cifra para Colombia en el año 2022: 230.000 hectáreas de coca sembradas en el país. Noticia completa en el siguiente link Abrimos hilo Simci",,,➡👉🧵,True,1,0,0,73,1,low,col_19,1
x-2026-02-09.csv,1701693760843694101,https://x.com/asgerafaelreyes/status/1701693760843694101,https://x.com/asgerafaelreyes/status/1701693760843694101/analytics,https://x.com/asgerafaelreyes,Asociación General Rafael Reyes,@asgerafaelreyes,"Sep 12, 2023",2023-09-12,,"Un informe del Sistema Integrado de Monitoreo de Cultivos Ilícitos ( ) de la Oficina de las Naciones Unidas contra la Droga y el Delito (UNODC) reveló un incremento del 13% en los cultivos de coca en el país, entre 2021 y 2022, pasando de 204.000 a 230.000 hectáreas en 2022. SIMCI","Un informe del Sistema Integrado de Monitoreo de Cultivos Ilícitos ( ) de la Oficina de las Naciones Unidas contra la Droga y el Delito (UNODC) reveló un incremento del 13% en los cultivos de coca en el país, entre 2021 y 2022, pasando de 204.000 a 230.000 hectáreas en 2022. SIMCI","Un informe del Sistema Integrado de Monitoreo de Cultivos Ilícitos ( ) de la Oficina de las Naciones Unidas contra la Droga y el Delito (UNODC) reveló un incremento del 13% en los cultivos de coca en el país, entre 2021 y 2022, pasando de 204.000 a 230.000 hectáreas en 2022. SIMCI",,,,True,0,0,0,11,0,none,,
x-2026-02-09.csv,1701639987270148289,https://x.com/LaRedHabla/status/1701639987270148289,https://x.com/LaRedHabla/status/1701639987270148289/analytics,https://x.com/LaRedHabla,Juan Carlos Espinal.,@LaRedHabla,"Sep 12, 2023",2023-09-12,,"Los cultivos de hoja de coca en Colombia crecieron 13% durante el año pasado, pasando de 204.000 hectáreas en 2021 a 230.000 en 2022, según el Informe del Sistema Integrado de Monitoreo de Cultivos Ilícitos ( ) de la Oficina de Naciones Unidas contra la Droga y el Delito. SIMCI 🇨🇴","Los cultivos de hoja de coca en Colombia crecieron 13% durante el año pasado, pasando de 204.000 hectáreas en 2021 a 230.000 en 2022, según el Informe del Sistema Integrado de Monitoreo de Cultivos Ilícitos ( ) de la Oficina de Naciones Unidas contra la Droga y el Delito. SIMCI 🇨🇴","Los cultivos de hoja de coca en Colombia crecieron 13% durante el año pasado, pasando de 204.000 hectáreas en 2021 a 230.000 en 2022, según el Informe del Sistema Integrado de Monitoreo de Cultivos Ilícitos ( ) de la Oficina de Naciones Unidas contra la Droga y el Delito. SIMCI",,,🇨🇴,True,1,0,0,71,1,low,col_19,1
x-2026-02-09.csv,1701634989543317590,https://x.com/NanoBotero/status/1701634989543317590,https://x.com/NanoBotero/status/1701634989543317590/analytics,https://x.com/NanoBotero,NanoBotero,@NanoBotero,"Sep 12, 2023",2023-09-12,Replying to @ANIABELLO_R and @FinancialTimes,"@ANIABELLO_R @FinancialTimes Dele las gracias a los que desmantelado la erradicación de cultivos ilícitos con aspersión aérea de glifosato, que redujo de casi 300.00 has a 47.000 has la zona cultivada, en menos de 10 años... Vaya mire de 2.008... SIMCI ⚕","@ANIABELLO_R @FinancialTimes Dele las gracias a los que desmantelado la erradicación de cultivos ilícitos con aspersión aérea de glifosato, que redujo de casi 300.00 has a 47.000 has la zona cultivada, en menos de 10 años... Vaya mire de 2.008... SIMCI ⚕","Dele las gracias a los que desmantelado la erradicación de cultivos ilícitos con aspersión aérea de glifosato, que redujo de casi 300.00 has a 47.000 has la zona cultivada, en menos de 10 años... Vaya mire de 2.008... SIMCI",@ANIABELLO_R|@FinancialTimes,,⚕,True,0,0,0,8,0,none,,
x-2026-02-09.csv,1701611429688918205,https://x.com/solsilvanazb/status/1701611429688918205,https://x.com/solsilvanazb/status/1701611429688918205/analytics,https://x.com/solsilvanazb,Silvana Zapata Bedoya EPI-SIG-DS,@solsilvanazb,"Sep 12, 2023",2023-09-12,,"#EpiMAP El día de hoy y a prósito del informe de UNODC sobre cultivos de coca en Colombia, les traigo dos #EpiSIG 1. Dinámica de los municipios afectados por coca y EVOA en 2021 y 2. Densidad de cultivos ilícitos ( ) en 2021 SIMCI 🇨🇴","#EpiMAP El día de hoy y a prósito del informe de UNODC sobre cultivos de coca en Colombia, les traigo dos #EpiSIG 1. Dinámica de los municipios afectados por coca y EVOA en 2021 y 2. Densidad de cultivos ilícitos ( ) en 2021 SIMCI 🇨🇴","EpiMAP El día de hoy y a prósito del informe de UNODC sobre cultivos de coca en Colombia, les traigo dos EpiSIG 1. Dinámica de los municipios afectados por coca y EVOA en 2021 y 2. Densidad de cultivos ilícitos ( ) en 2021 SIMCI",,#EpiMAP|#EpiSIG,🇨🇴,True,1,0,0,272,1,low,col_19,1
x-2026-02-09.csv,1701590415420293127,https://x.com/elexpresodia/status/1701590415420293127,https://x.com/elexpresodia/status/1701590415420293127/analytics,https://x.com/elexpresodia,El Expreso,@elexpresodia,"Sep 12, 2023",2023-09-12,,"#HoyQué | El Sistema Integrado de Monitoreo de Cultivos Ilícitos ( ) de la Oficina de las Naciones Unidas contra la Droga y el Delito (UNODC) reporta un incremento del 13 % en el área sembrada con coca en el país,. #Actualidad #Noticia SIMCI #Nacional","#HoyQué | El Sistema Integrado de Monitoreo de Cultivos Ilícitos ( ) de la Oficina de las Naciones Unidas contra la Droga y el Delito (UNODC) reporta un incremento del 13 % en el área sembrada con coca en el país,. #Actualidad #Noticia SIMCI #Nacional","HoyQué El Sistema Integrado de Monitoreo de Cultivos Ilícitos ( ) de la Oficina de las Naciones Unidas contra la Droga y el Delito (UNODC) reporta un incremento del 13 % en el área sembrada con coca en el país,. Actualidad Noticia SIMCI Nacional",,#Actualidad|#HoyQué|#Nacional|#Noticia,,True,0,0,0,29,0,none,,
x-2026-02-09.csv,1701576092002209948,https://x.com/JusticiaET/status/1701576092002209948,https://x.com/JusticiaET/status/1701576092002209948/analytics,https://x.com/JusticiaET,Justicia EL TIEMPO,@JusticiaET,"Sep 12, 2023",2023-09-12,,"El informe del año 2022 dejó varios indicadores como que en Putumayo, los cultivos de coca aumentaron en un 77% respecto al periodo de 2021. ¿Cuáles son las otras conclusiones? Le recomendamos este artículo: Simci","El informe del año 2022 dejó varios indicadores como que en Putumayo, los cultivos de coca aumentaron en un 77% respecto al periodo de 2021. ¿Cuáles son las otras conclusiones? Le recomendamos este artículo: Simci","El informe del año 2022 dejó varios indicadores como que en Putumayo, los cultivos de coca aumentaron en un 77% respecto al periodo de 2021. ¿Cuáles son las otras conclusiones? Le recomendamos este artículo: Simci",,,,True,2,1,0,766,2,medium,"col_19,col_31","1,2"
x-2026-02-08.csv,1701567818654011456,https://x.com/M_AaronZ/status/1701567818654011456,https://x.com/M_AaronZ/status/1701567818654011456/analytics,https://x.com/M_AaronZ,Mr. Aron.,@M_AaronZ,"Sep 12, 2023",2023-09-12,,Informe de Actividades: Monitoreo de Cultivos de Coca en Colombia 2022 Fecha: 11 de septiembre de 2023 Resumen: El Sistema Integrado de Monitoreo de Cultivos Ilícitos ( ) de la Oficina de las Naciones Unidas contra la Droga y el Delito (UNODC) ha publicado su informe anual SIMCI Gustavo Petro,Informe de Actividades: Monitoreo de Cultivos de Coca en Colombia 2022 Fecha: 11 de septiembre de 2023 Resumen: El Sistema Integrado de Monitoreo de Cultivos Ilícitos ( ) de la Oficina de las Naciones Unidas contra la Droga y el Delito (UNODC) ha publicado su informe anual SIMCI Gustavo Petro,Informe de Actividades: Monitoreo de Cultivos de Coca en Colombia 2022 Fecha: 11 de septiembre de 2023 Resumen: El Sistema Integrado de Monitoreo de Cultivos Ilícitos ( ) de la Oficina de las Naciones Unidas contra la Droga y el Delito (UNODC) ha publicado su informe anual SIMCI Gustavo Petro,,,,True,25,18,1,2500,3,high,"col_18,col_29,col_31","1,18,25"
x-2026-02-09.csv,1701559952798613625,https://x.com/HugoASeguridad/status/1701559952798613625,https://x.com/HugoASeguridad/status/1701559952798613625/analytics,https://x.com/HugoASeguridad,Hugo Acero,@HugoASeguridad,"Sep 12, 2023",2023-09-12,,"@petrogustavo El informe del Sistema Integrado de Monitoreo de Cultivos Ilícitos ( ) de Naciones Unidas muestra que: ni los cultivos, ni la producción, ni el consumo de coca han disminuido como pretende mostrar gobierno de Simci","@petrogustavo El informe del Sistema Integrado de Monitoreo de Cultivos Ilícitos ( ) de Naciones Unidas muestra que: ni los cultivos, ni la producción, ni el consumo de coca han disminuido como pretende mostrar gobierno de Simci","El informe del Sistema Integrado de Monitoreo de Cultivos Ilícitos ( ) de Naciones Unidas muestra que: ni los cultivos, ni la producción, ni el consumo de coca han disminuido como pretende mostrar gobierno de Simci",@petrogustavo,,,True,2,3,0,303,2,medium,"col_19,col_31","3,2"
x-2026-02-09.csv,1701408429191975167,https://x.com/Georgeburgos100/status/1701408429191975167,https://x.com/Georgeburgos100/status/1701408429191975167/analytics,https://x.com/Georgeburgos100,Jorge Burgos Garcia,@Georgeburgos100,"Sep 11, 2023",2023-09-11,,¿Cuáles son los tres departamentos que concentran el 65% de los cultivos con coca?,¿Cuáles son los tres departamentos que concentran el 65% de los cultivos con coca?,¿Cuáles son los tres departamentos que concentran el 65% de los cultivos con coca?,,,,False,0,0,0,6,0,none,,
x-2026-02-09.csv,1701354034295148570,https://x.com/PoliticaCol_GG/status/1701354034295148570,https://x.com/PoliticaCol_GG/status/1701354034295148570/analytics,https://x.com/PoliticaCol_GG,Política & Corrupción - (Cuenta #2) - #FueraPetro,@PoliticaCol_GG,"Sep 11, 2023",2023-09-11,,¿Cuáles son los tres departamentos que concentran el 65% de los cultivos con coca?,¿Cuáles son los tres departamentos que concentran el 65% de los cultivos con coca?,¿Cuáles son los tres departamentos que concentran el 65% de los cultivos con coca?,,,,False,0,0,0,2,0,none,,
x-2026-02-08.csv,1701343494873239994,https://x.com/bolivarcucuta/status/1701343494873239994,https://x.com/bolivarcucuta/status/1701343494873239994/analytics,https://x.com/bolivarcucuta,BolivarCucuta,@bolivarcucuta,"Sep 11, 2023",2023-09-11,,"En 2022, Los cultivos de coca se expandieron a 230,000 hectáreas. Los cultivos de coca continúan en aumento en Colombia, según un informe reciente del Sistema Integrado de Monitoreo de Cultivos Ilícitos ( ) de la Oficina de las Naciones Unidas contra la Droga y el Delito Simci","En 2022, Los cultivos de coca se expandieron a 230,000 hectáreas. Los cultivos de coca continúan en aumento en Colombia, según un informe reciente del Sistema Integrado de Monitoreo de Cultivos Ilícitos ( ) de la Oficina de las Naciones Unidas contra la Droga y el Delito Simci","En 2022, Los cultivos de coca se expandieron a 230,000 hectáreas. Los cultivos de coca continúan en aumento en Colombia, según un informe reciente del Sistema Integrado de Monitoreo de Cultivos Ilícitos ( ) de la Oficina de las Naciones Unidas contra la Droga y el Delito Simci",,,,True,2,1,0,1300,2,medium,"col_18,col_29","1,2"
x-2026-02-09.csv,1701327278498529364,https://x.com/andresmaciast/status/1701327278498529364,https://x.com/andresmaciast/status/1701327278498529364/analytics,https://x.com/andresmaciast,Andres Macias,@andresmaciast,"Sep 11, 2023",2023-09-11,,"Sobre el reciente informe de con relación a los territorios con presencia de cultivos de coca 2022... *Los cultivos de hoja de coca siguen aumentando, aunque a menor ritmo; *Se mantiene una gran concentración de cultivos en zonas específicas del país; SIMCI","Sobre el reciente informe de con relación a los territorios con presencia de cultivos de coca 2022... *Los cultivos de hoja de coca siguen aumentando, aunque a menor ritmo; *Se mantiene una gran concentración de cultivos en zonas específicas del país; SIMCI","Sobre el reciente informe de con relación a los territorios con presencia de cultivos de coca 2022... *Los cultivos de hoja de coca siguen aumentando, aunque a menor ritmo; *Se mantiene una gran concentración de cultivos en zonas específicas del país; SIMCI",,,,True,2,1,0,227,2,medium,"col_19,col_31","1,2"
x-2026-02-09.csv,1701319770249863360,https://x.com/ecuadorenvivo/status/1701319770249863360,https://x.com/ecuadorenvivo/status/1701319770249863360/analytics,https://x.com/ecuadorenvivo,ecuadorenvivo,@ecuadorenvivo,"Sep 11, 2023",2023-09-11,,"@ONU_es De acuerdo con cifras alarmantes del Sistema Integrado de Monitoreo de Cultivos Ilícitos ( ), Colombia ha experimentado un aumento significativo en la producción de coca durante el último año. #Colombia Simci 👉","@ONU_es De acuerdo con cifras alarmantes del Sistema Integrado de Monitoreo de Cultivos Ilícitos ( ), Colombia ha experimentado un aumento significativo en la producción de coca durante el último año. #Colombia Simci 👉","De acuerdo con cifras alarmantes del Sistema Integrado de Monitoreo de Cultivos Ilícitos ( ), Colombia ha experimentado un aumento significativo en la producción de coca durante el último año. Colombia Simci",@ONU_es,#Colombia,👉,True,1,0,0,647,1,low,col_19,1
x-2026-02-09.csv,1701306908727013589,https://x.com/federicoalves/status/1701306908727013589,https://x.com/federicoalves/status/1701306908727013589/analytics,https://x.com/federicoalves,"Federico Alves, Econ.",@federicoalves,"Sep 11, 2023",2023-09-11,,"Cultivos de coca rompen récord en Colombia, según Naciones Unidas: llegaron a 230.000 hectáreas en 2022 El informe del Sistema Integrado de Monitoreo de Cultivos Ilícitos ( ), de la Oficina de las Naciones Unidas contra la Droga y el Delito (Unodc), mostró la preocupante Simci 🇺🇳 🇨🇴","Cultivos de coca rompen récord en Colombia, según Naciones Unidas: llegaron a 230.000 hectáreas en 2022 El informe del Sistema Integrado de Monitoreo de Cultivos Ilícitos ( ), de la Oficina de las Naciones Unidas contra la Droga y el Delito (Unodc), mostró la preocupante Simci 🇺🇳 🇨🇴","Cultivos de coca rompen récord en Colombia, según Naciones Unidas: llegaron a 230.000 hectáreas en 2022 El informe del Sistema Integrado de Monitoreo de Cultivos Ilícitos ( ), de la Oficina de las Naciones Unidas contra la Droga y el Delito (Unodc), mostró la preocupante Simci",,,🇨🇴🇺🇳,True,1,1,0,194,2,medium,"col_19,col_31","1,1"
x-2026-02-08.csv,1701302086053535764,https://x.com/ELTIEMPO/status/1701302086053535764,https://x.com/ELTIEMPO/status/1701302086053535764/analytics,https://x.com/ELTIEMPO,EL TIEMPO,@ELTIEMPO,"Sep 11, 2023",2023-09-11,,@JusticiaET ¿Cuáles son los tres departamentos que concentran el 65% de los cultivos con coca? ► Naciones Unidas presenta el informe oficial de 2022 sobre cultivos de matas de coca en Colombia. Vía,@JusticiaET ¿Cuáles son los tres departamentos que concentran el 65% de los cultivos con coca? ► Naciones Unidas presenta el informe oficial de 2022 sobre cultivos de matas de coca en Colombia. Vía,¿Cuáles son los tres departamentos que concentran el 65% de los cultivos con coca? Naciones Unidas presenta el informe oficial de 2022 sobre cultivos de matas de coca en Colombia. Vía,@JusticiaET,,¿Cuáles son los tres departamentos que concentran el 65% de los cultivos con coca? ►,False,4,1,1,6700,3,high,"col_18,col_29,col_31","1,1,4"
x-2026-02-09.csv,1701300499033583618,https://x.com/JuniorMaldon1/status/1701300499033583618,https://x.com/JuniorMaldon1/status/1701300499033583618/analytics,https://x.com/JuniorMaldon1,Junior Maldonado,@JuniorMaldon1,"Sep 11, 2023",2023-09-11,,@UNODC 1/2 El informe de de del 2022 de presencia del cultivos de uso ilicitos en Colombia detalla una contención de la siembra de cultivos de coca en la region del Catatumbo de 42.576ha del 2021 a 2022 de 42.043ha una reducción de 533ha SIMCI Gustavo Petro,@UNODC 1/2 El informe de de del 2022 de presencia del cultivos de uso ilicitos en Colombia detalla una contención de la siembra de cultivos de coca en la region del Catatumbo de 42.576ha del 2021 a 2022 de 42.043ha una reducción de 533ha SIMCI Gustavo Petro,1/2 El informe de de del 2022 de presencia del cultivos de uso ilicitos en Colombia detalla una contención de la siembra de cultivos de coca en la region del Catatumbo de 42.576ha del 2021 a 2022 de 42.043ha una reducción de 533ha SIMCI Gustavo Petro,@UNODC,,,True,3,2,1,507,3,high,"col_19,col_31,col_32","1,2,3"
x-2026-02-09.csv,1701296410077856240,https://x.com/jorgmara/status/1701296410077856240,https://x.com/jorgmara/status/1701296410077856240/analytics,https://x.com/jorgmara,jorge marquez,@jorgmara,"Sep 11, 2023",2023-09-11,,¿Cuáles son los tres departamentos que concentran el 65% de los cultivos con coca?,¿Cuáles son los tres departamentos que concentran el 65% de los cultivos con coca?,¿Cuáles son los tres departamentos que concentran el 65% de los cultivos con coca?,,,,False,0,0,0,2,0,none,,
x-2026-02-09.csv,1701274952194728021,https://x.com/TheStagHunt/status/1701274952194728021,https://x.com/TheStagHunt/status/1701274952194728021/analytics,https://x.com/TheStagHunt,Alberto Sánchez Galeano,@TheStagHunt,"Sep 11, 2023",2023-09-11,,"Este dato de debe ser prioridad para cualquier candidato a la Alcaldía de Cali: ""Entre los límites del Cauca y Valle del Cauca se conformó un nuevo enclave con 1.436 hectáreas. Ese enclave, por su ubicación, se denomina: Timba-Jamundí-Buenos Aires"". SIMCI","Este dato de debe ser prioridad para cualquier candidato a la Alcaldía de Cali: ""Entre los límites del Cauca y Valle del Cauca se conformó un nuevo enclave con 1.436 hectáreas. Ese enclave, por su ubicación, se denomina: Timba-Jamundí-Buenos Aires"". SIMCI","Este dato de debe ser prioridad para cualquier candidato a la Alcaldía de Cali: ""Entre los límites del Cauca y Valle del Cauca se conformó un nuevo enclave con 1.436 hectáreas. Ese enclave, por su ubicación, se denomina: Timba-Jamundí-Buenos Aires"". SIMCI",,,,True,4,2,0,632,2,medium,"col_19,col_31","2,4"
