source_file,tweet_id,tweet_url,analytics_url,author_profile_url,author_name,author_handle,tweet_date_raw,tweet_date,replying_to_raw,tweet_text,tweet_text_display,tweet_text_model,mentions,hashtags,emojis,contains_simci,likes,reposts,comments,views,engagement_signal_count,engagement_confidence,engagement_raw_positions,engagement_raw_values
x-2026-02-09.csv,1440844353006563330,https://x.com/jchoyos22/status/1440844353006563330,https://x.com/jchoyos22/status/1440844353006563330/analytics,https://x.com/jchoyos22,JM,@jchoyos22,"Sep 22, 2021",2021-09-22,Replying to @glvr209324 and @primeravoztv,"@glvr209324 @primeravoztv Según el ( ) SISTEMA INTEGRADO DE MONITOREO DE CULTIVOS ILÍCITOS. Hectareas 2019 154.000 Hectareas 2020 143.000 No obstante que su amigo Santos, logró que prohibieran la aspersion áerea, con el mismo glifosato que fumigan sus verduritas. Y la reducción esta hecha a MANO. SIMCI 🫡","@glvr209324 @primeravoztv Según el ( ) SISTEMA INTEGRADO DE MONITOREO DE CULTIVOS ILÍCITOS. Hectareas 2019 154.000 Hectareas 2020 143.000 No obstante que su amigo Santos, logró que prohibieran la aspersion áerea, con el mismo glifosato que fumigan sus verduritas. Y la reducción esta hecha a MANO. SIMCI 🫡","Según el ( ) SISTEMA INTEGRADO DE MONITOREO DE CULTIVOS ILÍCITOS. Hectareas 2019 154.000 Hectareas 2020 143.000 No obstante que su amigo Santos, logró que prohibieran la aspersion áerea, con el mismo glifosato que fumigan sus verduritas. Y la reducción esta hecha a MANO. SIMCI 🫡",@glvr209324|@primeravoztv,,🫡,True,0,0,0,0,0,none,,
x-2026-02-09.csv,1432870424866693121,https://x.com/elizabe33673657/status/1432870424866693121,https://x.com/elizabe33673657/status/1432870424866693121/analytics,https://x.com/elizabe33673657,elizabeth bernal,@elizabe33673657,"Aug 31, 2021",2021-08-31,Replying to @KikeMar55855255 @petrogustavo and @marioherzam,@KikeMar55855255 @petrogustavo @marioherzam una razones por la que debe ser aprobada es que Según datos del Sistema Integrado de Monitoreo de Cultivos de uso Ilícito ( SIMCI ) Colombia pasó en 2007 de tener 68.000 hectáreas sembradas a tener 171.000 de cultivo de coca. Son en total 103.000 hectáreas más que hace diez años.,@KikeMar55855255 @petrogustavo @marioherzam una razones por la que debe ser aprobada es que Según datos del Sistema Integrado de Monitoreo de Cultivos de uso Ilícito ( SIMCI ) Colombia pasó en 2007 de tener 68.000 hectáreas sembradas a tener 171.000 de cultivo de coca. Son en total 103.000 hectáreas más que hace diez años.,una razones por la que debe ser aprobada es que Según datos del Sistema Integrado de Monitoreo de Cultivos de uso Ilícito ( SIMCI ) Colombia pasó en 2007 de tener 68.000 hectáreas sembradas a tener 171.000 de cultivo de coca. Son en total 103.000 hectáreas más que hace diez años.,@KikeMar55855255|@marioherzam|@petrogustavo,,,True,0,0,0,0,0,none,,
x-2026-02-09.csv,1432745051428425730,https://x.com/CIB_UPPachuca/status/1432745051428425730,https://x.com/CIB_UPPachuca/status/1432745051428425730/analytics,https://x.com/CIB_UPPachuca,@CIB.UPPachuca,@CIB_UPPachuca,"Aug 31, 2021",2021-08-31,,"#NuestraRazónDeSerTú Aún estás a tiempo de participar en el 2021, el cual tiene como propósito difundir el quehacer científico, tecnológico y de innovación #OrgulloUPP #BuenLunes Todavía estás a tiempo de participar en el Simposio Iberoamericano Multidisciplinario de Ciencias e Ingenierías, el cual tiene como propósito difundir el quehacer científico, tecnológico y de innovación. Universidad Politécnica de Pachuca @UPPachuca #OperativoEscudo #SIMCI @SriaAcademica @UPPlaneacion @Est_Profesional @UPPach_Posgrado @cultura_upp","#NuestraRazónDeSerTú Aún estás a tiempo de participar en el 2021, el cual tiene como propósito difundir el quehacer científico, tecnológico y de innovación #OrgulloUPP #BuenLunes Todavía estás a tiempo de participar en el Simposio Iberoamericano Multidisciplinario de Ciencias e Ingenierías, el cual tiene como propósito difundir el quehacer científico, tecnológico y de innovación. Universidad Politécnica de Pachuca @UPPachuca #OperativoEscudo #SIMCI @SriaAcademica @UPPlaneacion @Est_Profesional @UPPach_Posgrado @cultura_upp","NuestraRazónDeSerTú Aún estás a tiempo de participar en el 2021, el cual tiene como propósito difundir el quehacer científico, tecnológico y de innovación OrgulloUPP BuenLunes Todavía estás a tiempo de participar en el Simposio Iberoamericano Multidisciplinario de Ciencias e Ingenierías, el cual tiene como propósito difundir el quehacer científico, tecnológico y de innovación. Universidad Politécnica de Pachuca OperativoEscudo SIMCI",@Est_Profesional|@SriaAcademica|@UPPach_Posgrado|@UPPachuca|@UPPlaneacion|@cultura_upp,#BuenLunes|#NuestraRazónDeSerTú|#OperativoEscudo|#OrgulloUPP|#SIMCI,,True,3,3,0,0,2,medium,"col_19,col_31","3,3"
x-2026-02-09.csv,1432448895985098756,https://x.com/UPPachuca/status/1432448895985098756,https://x.com/UPPachuca/status/1432448895985098756/analytics,https://x.com/UPPachuca,Universidad Politécnica de Pachuca,@UPPachuca,"Aug 30, 2021",2021-08-30,,"#BuenLunes Todavía estás a tiempo de participar en el Simposio Iberoamericano Multidisciplinario de Ciencias e Ingenierías, el cual tiene como propósito difundir el quehacer científico, tecnológico y de innovación. #OperativoEscudo #OrgulloUPP","#BuenLunes Todavía estás a tiempo de participar en el Simposio Iberoamericano Multidisciplinario de Ciencias e Ingenierías, el cual tiene como propósito difundir el quehacer científico, tecnológico y de innovación. #OperativoEscudo #OrgulloUPP","BuenLunes Todavía estás a tiempo de participar en el Simposio Iberoamericano Multidisciplinario de Ciencias e Ingenierías, el cual tiene como propósito difundir el quehacer científico, tecnológico y de innovación. OperativoEscudo OrgulloUPP",,#BuenLunes|#OperativoEscudo|#OrgulloUPP,,False,7,7,0,0,2,medium,"col_19,col_31","7,7"
x-2026-02-09.csv,1431450646482505731,https://x.com/Brandon83831664/status/1431450646482505731,https://x.com/Brandon83831664/status/1431450646482505731/analytics,https://x.com/Brandon83831664,BrandonValdez,@Brandon83831664,"Aug 27, 2021",2021-08-27,,"La coca, los estragos del tercer producto más exportado de... HEH, I LIKE THIS","La coca, los estragos del tercer producto más exportado de... HEH, I LIKE THIS","La coca, los estragos del tercer producto más exportado de... HEH, I LIKE THIS",,,,False,0,0,0,0,0,none,,
x-2026-02-09.csv,1431296700375871492,https://x.com/ObservDrogasCo/status/1431296700375871492,https://x.com/ObservDrogasCo/status/1431296700375871492/analytics,https://x.com/ObservDrogasCo,Observatorio de Drogas de Colombia,@ObservDrogasCo,"Aug 27, 2021",2021-08-27,,#SabíasQué ¿El área sembrada con coca en Parques Nacionales Naturales (PNN) es monitoreada por desde el 2001? Conoce más en el Informe Anual de Monitoreo de Territorios Afectados por #CultivosIlícitos SIMCI,#SabíasQué ¿El área sembrada con coca en Parques Nacionales Naturales (PNN) es monitoreada por desde el 2001? Conoce más en el Informe Anual de Monitoreo de Territorios Afectados por #CultivosIlícitos SIMCI,SabíasQué ¿El área sembrada con coca en Parques Nacionales Naturales (PNN) es monitoreada por desde el 2001? Conoce más en el Informe Anual de Monitoreo de Territorios Afectados por CultivosIlícitos SIMCI,,#CultivosIlícitos|#SabíasQué,,True,2,0,0,0,1,low,col_19,2
x-2026-02-09.csv,1431293253027090438,https://x.com/CIB_UPPachuca/status/1431293253027090438,https://x.com/CIB_UPPachuca/status/1431293253027090438/analytics,https://x.com/CIB_UPPachuca,@CIB.UPPachuca,@CIB_UPPachuca,"Aug 27, 2021",2021-08-27,,"#NuestraRazónDeSerTú Aún estás a tiempo de participar en el, el cual busca difundir el quehacer científico, tecnológico y de innovación Registro tus trabajos: #SIMCI2021 Te invitamos a participar en el Simposio Iberoamericano Multidisciplinario de Ciencias e Ingenierías, el cual tiene como propósito difundir el quehacer científico, tecnológico y de innovación. Registra tus trabajos. Más informes en: SEP Hidalgo @SEPHidalgo @SriaAcademica @UPPlaneacion @Est_Profesional @UPPach_Posgrado @cultura_upp","#NuestraRazónDeSerTú Aún estás a tiempo de participar en el, el cual busca difundir el quehacer científico, tecnológico y de innovación Registro tus trabajos: #SIMCI2021 Te invitamos a participar en el Simposio Iberoamericano Multidisciplinario de Ciencias e Ingenierías, el cual tiene como propósito difundir el quehacer científico, tecnológico y de innovación. Registra tus trabajos. Más informes en: SEP Hidalgo @SEPHidalgo @SriaAcademica @UPPlaneacion @Est_Profesional @UPPach_Posgrado @cultura_upp","NuestraRazónDeSerTú Aún estás a tiempo de participar en el, el cual busca difundir el quehacer científico, tecnológico y de innovación Registro tus trabajos: SIMCI2021 Te invitamos a participar en el Simposio Iberoamericano Multidisciplinario de Ciencias e Ingenierías, el cual tiene como propósito difundir el quehacer científico, tecnológico y de innovación. Registra tus trabajos. Más informes en: SEP Hidalgo",@Est_Profesional|@SEPHidalgo|@SriaAcademica|@UPPach_Posgrado|@UPPlaneacion|@cultura_upp,#NuestraRazónDeSerTú|#SIMCI2021,,False,3,3,0,0,2,medium,"col_19,col_31","3,3"
x-2026-02-09.csv,1430559714056839169,https://x.com/UPPachuca/status/1430559714056839169,https://x.com/UPPachuca/status/1430559714056839169/analytics,https://x.com/UPPachuca,Universidad Politécnica de Pachuca,@UPPachuca,"Aug 25, 2021",2021-08-25,,"#BuenMiércoles Todavía estás a tiempo de participar en el Simposio Iberoamericano Multidisciplinario de Ciencias e Ingenierías, el cual tiene como propósito difundir el quehacer científico, tecnológico y de innovación. #OperativoEscudo #OrgulloUPP","#BuenMiércoles Todavía estás a tiempo de participar en el Simposio Iberoamericano Multidisciplinario de Ciencias e Ingenierías, el cual tiene como propósito difundir el quehacer científico, tecnológico y de innovación. #OperativoEscudo #OrgulloUPP","BuenMiércoles Todavía estás a tiempo de participar en el Simposio Iberoamericano Multidisciplinario de Ciencias e Ingenierías, el cual tiene como propósito difundir el quehacer científico, tecnológico y de innovación. OperativoEscudo OrgulloUPP",,#BuenMiércoles|#OperativoEscudo|#OrgulloUPP,,False,2,2,0,0,2,medium,"col_19,col_31","2,2"
x-2026-02-09.csv,1430208342312509443,https://x.com/UPPachuca/status/1430208342312509443,https://x.com/UPPachuca/status/1430208342312509443/analytics,https://x.com/UPPachuca,Universidad Politécnica de Pachuca,@UPPachuca,"Aug 24, 2021",2021-08-24,,"#BuenMartes Aún estás a tiempo de participar en el Simposio Iberoamericano Multidisciplinario de Ciencias e Ingenierías, tiene como propósito difundir el quehacer científico, tecnológico y de innovación. Más informes en: #OperativoEscudo #OrgulloUPP","#BuenMartes Aún estás a tiempo de participar en el Simposio Iberoamericano Multidisciplinario de Ciencias e Ingenierías, tiene como propósito difundir el quehacer científico, tecnológico y de innovación. Más informes en: #OperativoEscudo #OrgulloUPP","BuenMartes Aún estás a tiempo de participar en el Simposio Iberoamericano Multidisciplinario de Ciencias e Ingenierías, tiene como propósito difundir el quehacer científico, tecnológico y de innovación. Más informes en: OperativoEscudo OrgulloUPP",,#BuenMartes|#OperativoEscudo|#OrgulloUPP,,False,3,2,0,0,2,medium,"col_19,col_31","2,3"
x-2026-02-09.csv,1429928709633478657,https://x.com/visomutop/status/1429928709633478657,https://x.com/visomutop/status/1429928709633478657/analytics,https://x.com/visomutop,Viso Mutop,@visomutop,"Aug 23, 2021",2021-08-23,,"@MinjusticiaCo A propósito de reciente reporte de @UNODCColombia @suribe52 una opinion de @RazonPublica en. Metodología, verificación y capacidad de análisis de datos pueden explicar en parte las diferencias entre gobiernos de Colombia y EEUU. SIMCI","@MinjusticiaCo A propósito de reciente reporte de @UNODCColombia @suribe52 una opinion de @RazonPublica en. Metodología, verificación y capacidad de análisis de datos pueden explicar en parte las diferencias entre gobiernos de Colombia y EEUU. SIMCI","A propósito de reciente reporte de una opinion de en. Metodología, verificación y capacidad de análisis de datos pueden explicar en parte las diferencias entre gobiernos de Colombia y EEUU. SIMCI",@MinjusticiaCo|@RazonPublica|@UNODCColombia|@suribe52,,,True,1,1,0,0,2,medium,"col_19,col_31","1,1"
x-2026-02-09.csv,1428863482582159362,https://x.com/CIB_UPPachuca/status/1428863482582159362,https://x.com/CIB_UPPachuca/status/1428863482582159362/analytics,https://x.com/CIB_UPPachuca,@CIB.UPPachuca,@CIB_UPPachuca,"Aug 20, 2021",2021-08-20,,"#NuestraRazónDeSerTú La te invita a participar en el @UPPachuca, el cual tiene como propósito difundir el quehacer científico, tecnológico y de innovación ¡Aprovecha esta oportunidad! @SriaAcademica Te invitamos a participar en el Simposio Iberoamericano Multidisciplinario de Ciencias e Ingenierías, el cual tiene como propósito difundir el quehacer científico, tecnológico y de innovación. Registra tus trabajos. Más informes en: SEP Hidalgo @SEPHidalgo #SIMCI @PlaneacionSEPH @Est_Profesional @UPPach_Posgrado @cultura_upp","#NuestraRazónDeSerTú La te invita a participar en el @UPPachuca, el cual tiene como propósito difundir el quehacer científico, tecnológico y de innovación ¡Aprovecha esta oportunidad! @SriaAcademica Te invitamos a participar en el Simposio Iberoamericano Multidisciplinario de Ciencias e Ingenierías, el cual tiene como propósito difundir el quehacer científico, tecnológico y de innovación. Registra tus trabajos. Más informes en: SEP Hidalgo @SEPHidalgo #SIMCI @PlaneacionSEPH @Est_Profesional @UPPach_Posgrado @cultura_upp","NuestraRazónDeSerTú La te invita a participar en el , el cual tiene como propósito difundir el quehacer científico, tecnológico y de innovación ¡Aprovecha esta oportunidad! Te invitamos a participar en el Simposio Iberoamericano Multidisciplinario de Ciencias e Ingenierías, el cual tiene como propósito difundir el quehacer científico, tecnológico y de innovación. Registra tus trabajos. Más informes en: SEP Hidalgo SIMCI",@Est_Profesional|@PlaneacionSEPH|@SEPHidalgo|@SriaAcademica|@UPPach_Posgrado|@UPPachuca|@cultura_upp,#NuestraRazónDeSerTú|#SIMCI,,True,4,3,0,0,2,medium,"col_19,col_31","3,4"
x-2026-02-09.csv,1428424023617282048,https://x.com/SEPHidalgo/status/1428424023617282048,https://x.com/SEPHidalgo/status/1428424023617282048/analytics,https://x.com/SEPHidalgo,SEP Hidalgo,@SEPHidalgo,"Aug 19, 2021",2021-08-19,,"Te invitamos a participar en el Simposio Iberoamericano Multidisciplinario de Ciencias e Ingenierías, el cual tiene como propósito difundir el quehacer científico, tecnológico y de innovación. Registra tus trabajos. Más informes en:","Te invitamos a participar en el Simposio Iberoamericano Multidisciplinario de Ciencias e Ingenierías, el cual tiene como propósito difundir el quehacer científico, tecnológico y de innovación. Registra tus trabajos. Más informes en:","Te invitamos a participar en el Simposio Iberoamericano Multidisciplinario de Ciencias e Ingenierías, el cual tiene como propósito difundir el quehacer científico, tecnológico y de innovación. Registra tus trabajos. Más informes en:",,,,False,8,6,0,0,2,medium,"col_19,col_31","6,8"
x-2026-02-09.csv,1427756613767733255,https://x.com/SEPHidalgo/status/1427756613767733255,https://x.com/SEPHidalgo/status/1427756613767733255/analytics,https://x.com/SEPHidalgo,SEP Hidalgo,@SEPHidalgo,"Aug 17, 2021",2021-08-17,,"Te invitamos a participar en el Simposio Iberoamericano Multidisciplinario de Ciencias e Ingenierías, el cual tiene como propósito difundir el quehacer científico, tecnológico y de innovación. Registra tus trabajos. Más informes en:","Te invitamos a participar en el Simposio Iberoamericano Multidisciplinario de Ciencias e Ingenierías, el cual tiene como propósito difundir el quehacer científico, tecnológico y de innovación. Registra tus trabajos. Más informes en:","Te invitamos a participar en el Simposio Iberoamericano Multidisciplinario de Ciencias e Ingenierías, el cual tiene como propósito difundir el quehacer científico, tecnológico y de innovación. Registra tus trabajos. Más informes en:",,,,False,7,5,0,0,2,medium,"col_19,col_31","5,7"
x-2026-02-09.csv,1426218849456754690,https://x.com/CITNOVA/status/1426218849456754690,https://x.com/CITNOVA/status/1426218849456754690/analytics,https://x.com/CITNOVA,CITNOVA,@CITNOVA,"Aug 13, 2021",2021-08-13,,#Súmate La invita a participar en el @UPPachuca Simposio Iberoamericano Multidisciplinario de Ciencias e Ingenierías ( ) Fecha límite de recepción de trabajos 18 de ago. Se enviará aviso de aceptación de artículos del 6 al 10 de sep. SIMCI Info.: Gobierno Hidalgo 🔴 🔷 📲,#Súmate La invita a participar en el @UPPachuca Simposio Iberoamericano Multidisciplinario de Ciencias e Ingenierías ( ) Fecha límite de recepción de trabajos 18 de ago. Se enviará aviso de aceptación de artículos del 6 al 10 de sep. SIMCI Info.: Gobierno Hidalgo 🔴 🔷 📲,Súmate La invita a participar en el Simposio Iberoamericano Multidisciplinario de Ciencias e Ingenierías ( ) Fecha límite de recepción de trabajos 18 de ago. Se enviará aviso de aceptación de artículos del 6 al 10 de sep. SIMCI Info.: Gobierno Hidalgo,@UPPachuca,#Súmate,📲🔴🔷,True,8,8,0,0,2,medium,"col_19,col_31","8,8"
x-2026-02-09.csv,1425871132461342720,https://x.com/UPPachuca/status/1425871132461342720,https://x.com/UPPachuca/status/1425871132461342720/analytics,https://x.com/UPPachuca,Universidad Politécnica de Pachuca,@UPPachuca,"Aug 12, 2021",2021-08-12,,"#BuenJueves Te invitamos a participar en el Simposio Iberoamericano Multidisciplinario de Ciencias e Ingenierías, el cual tiene como propósito difundir el quehacer científico, tecnológico y de innovación. Más informes en: #OperativoEscudo #ActitudUPP","#BuenJueves Te invitamos a participar en el Simposio Iberoamericano Multidisciplinario de Ciencias e Ingenierías, el cual tiene como propósito difundir el quehacer científico, tecnológico y de innovación. Más informes en: #OperativoEscudo #ActitudUPP","BuenJueves Te invitamos a participar en el Simposio Iberoamericano Multidisciplinario de Ciencias e Ingenierías, el cual tiene como propósito difundir el quehacer científico, tecnológico y de innovación. Más informes en: OperativoEscudo ActitudUPP",,#ActitudUPP|#BuenJueves|#OperativoEscudo,,False,2,2,0,0,2,medium,"col_19,col_31","2,2"
x-2026-02-09.csv,1425540708488949768,https://x.com/CIB_UPPachuca/status/1425540708488949768,https://x.com/CIB_UPPachuca/status/1425540708488949768/analytics,https://x.com/CIB_UPPachuca,@CIB.UPPachuca,@CIB_UPPachuca,"Aug 11, 2021",2021-08-11,,"#NuestraRazónDeSerTú La te invita a participar en el @UPPachuca, el cual tiene como propósito difundir el quehacer científico, tecnológico y de innovación. ¡Aprovecha esta oportunidad! @SriaAcademica #BuenMiércoles Participa en el Simposio Iberoamericano Multidisciplinario de Ciencias e Ingenierías, el cual tiene como propósito difundir el quehacer científico, tecnológico y de innovación. ¡No te quedes fuera! Universidad Politécnica de Pachuca #OperativoEscudo #SIMCI @PlaneacionSEPH @Est_Profesional @UPPach_Posgrado @cultura_upp","#NuestraRazónDeSerTú La te invita a participar en el @UPPachuca, el cual tiene como propósito difundir el quehacer científico, tecnológico y de innovación. ¡Aprovecha esta oportunidad! @SriaAcademica #BuenMiércoles Participa en el Simposio Iberoamericano Multidisciplinario de Ciencias e Ingenierías, el cual tiene como propósito difundir el quehacer científico, tecnológico y de innovación. ¡No te quedes fuera! Universidad Politécnica de Pachuca #OperativoEscudo #SIMCI @PlaneacionSEPH @Est_Profesional @UPPach_Posgrado @cultura_upp","NuestraRazónDeSerTú La te invita a participar en el , el cual tiene como propósito difundir el quehacer científico, tecnológico y de innovación. ¡Aprovecha esta oportunidad! BuenMiércoles Participa en el Simposio Iberoamericano Multidisciplinario de Ciencias e Ingenierías, el cual tiene como propósito difundir el quehacer científico, tecnológico y de innovación. ¡No te quedes fuera! Universidad Politécnica de Pachuca OperativoEscudo SIMCI",@Est_Profesional|@PlaneacionSEPH|@SriaAcademica|@UPPach_Posgrado|@UPPachuca|@cultura_upp,#BuenMiércoles|#NuestraRazónDeSerTú|#OperativoEscudo|#SIMCI,,True,3,3,0,0,2,medium,"col_19,col_31","3,3"
x-2026-02-09.csv,1425498687690756103,https://x.com/suribe52/status/1425498687690756103,https://x.com/suribe52/status/1425498687690756103/analytics,https://x.com/suribe52,Sergio Uribe,@suribe52,"Aug 11, 2021",2021-08-11,,"@minjusticia @UNODCColombia que informen presidente Duque variedades/cultivariedades, contenido alkaloids cultivos coca Colombia. Que @mindefensa demuestre que inversión Estado colombiano últimos 20 años No ha sido desperdicio recursos pa manutención burocracia cara inepta SIMCI","@minjusticia @UNODCColombia que informen presidente Duque variedades/cultivariedades, contenido alkaloids cultivos coca Colombia. Que @mindefensa demuestre que inversión Estado colombiano últimos 20 años No ha sido desperdicio recursos pa manutención burocracia cara inepta SIMCI","que informen presidente Duque variedades/cultivariedades, contenido alkaloids cultivos coca Colombia. Que demuestre que inversión Estado colombiano últimos 20 años No ha sido desperdicio recursos pa manutención burocracia cara inepta SIMCI",@UNODCColombia|@mindefensa|@minjusticia,,,True,0,0,0,0,0,none,,
x-2026-02-09.csv,1424162407723806722,https://x.com/waldoalarconho1/status/1424162407723806722,https://x.com/waldoalarconho1/status/1424162407723806722/analytics,https://x.com/waldoalarconho1,DESTRUCTOR II De Mamertos.,@waldoalarconho1,"Aug 7, 2021",2021-08-07,Replying to @derecha_tu and @AvilaJulioce,@derecha_tu @AvilaJulioce Acuerdo a el departamento de Nariño fue el que más aumentó los cultivos de coca mientras fue gobernador. SIMCI,@derecha_tu @AvilaJulioce Acuerdo a el departamento de Nariño fue el que más aumentó los cultivos de coca mientras fue gobernador. SIMCI,Acuerdo a el departamento de Nariño fue el que más aumentó los cultivos de coca mientras fue gobernador. SIMCI,@AvilaJulioce|@derecha_tu,,,True,1,0,0,0,1,low,col_19,1
x-2026-02-09.csv,1422214398278516740,https://x.com/JerezSandoval/status/1422214398278516740,https://x.com/JerezSandoval/status/1422214398278516740/analytics,https://x.com/JerezSandoval,JerezSandoval,@JerezSandoval,"Aug 2, 2021",2021-08-02,,"@ELTIEMPO Informe anual, identifico que el 84 por ciento de toda la coca sembrada está en zonas en donde este cultivo lleva más de 10 años. vía Simci","@ELTIEMPO Informe anual, identifico que el 84 por ciento de toda la coca sembrada está en zonas en donde este cultivo lleva más de 10 años. vía Simci","Informe anual, identifico que el 84 por ciento de toda la coca sembrada está en zonas en donde este cultivo lleva más de 10 años. vía Simci",@ELTIEMPO,,,True,0,0,0,0,0,none,,
x-2026-02-09.csv,1421904504694480901,https://x.com/suribe52/status/1421904504694480901,https://x.com/suribe52/status/1421904504694480901/analytics,https://x.com/suribe52,Sergio Uribe,@suribe52,"Aug 1, 2021",2021-08-01,,"@eltiempo poco placentero leer un artículo tan superfluo y falto de análisis. Periodismo inútil ni siquiera informativo. Artículo es como informe sin claves ni razones gasto de tinta, papel y tiempo del lector SIMCI","@eltiempo poco placentero leer un artículo tan superfluo y falto de análisis. Periodismo inútil ni siquiera informativo. Artículo es como informe sin claves ni razones gasto de tinta, papel y tiempo del lector SIMCI","poco placentero leer un artículo tan superfluo y falto de análisis. Periodismo inútil ni siquiera informativo. Artículo es como informe sin claves ni razones gasto de tinta, papel y tiempo del lector SIMCI",@eltiempo,,,True,0,0,0,0,0,none,,
x-2026-02-09.csv,1421860001338073094,https://x.com/JulioAcelas/status/1421860001338073094,https://x.com/JulioAcelas/status/1421860001338073094/analytics,https://x.com/JulioAcelas,JulioAcelas,@JulioAcelas,"Aug 1, 2021",2021-08-01,,"#SanPablo Nuestro vecino,, Nuevo ENCLAVE cocalero y DESGOBIERNO Total El 29 % de la coca del país está en los territorios étnicos y parques @eltiempo Departamento de Policía Magdalena Medio @BcaVirtual @ccbarrancabja @UNIPAZnoticias @PoliciaAntiNar @UIS @LaureanoTirado @C_Pueblos","#SanPablo Nuestro vecino,, Nuevo ENCLAVE cocalero y DESGOBIERNO Total El 29 % de la coca del país está en los territorios étnicos y parques @eltiempo Departamento de Policía Magdalena Medio @BcaVirtual @ccbarrancabja @UNIPAZnoticias @PoliciaAntiNar @UIS @LaureanoTirado @C_Pueblos","SanPablo Nuestro vecino,, Nuevo ENCLAVE cocalero y DESGOBIERNO Total El 29 % de la coca del país está en los territorios étnicos y parques Departamento de Policía Magdalena Medio",@BcaVirtual|@C_Pueblos|@LaureanoTirado|@PoliciaAntiNar|@UIS|@UNIPAZnoticias|@ccbarrancabja|@eltiempo,#SanPablo,,False,2,2,0,0,2,medium,"col_19,col_31","2,2"
