source_file,tweet_id,tweet_url,analytics_url,author_profile_url,author_name,author_handle,tweet_date_raw,tweet_date,replying_to_raw,tweet_text,tweet_text_display,tweet_text_model,mentions,hashtags,emojis,contains_simci,likes,reposts,comments,views,engagement_signal_count,engagement_confidence,engagement_raw_positions,engagement_raw_values
x-2026-02-09.csv,1849852265441657089,https://x.com/CarrillonavasG/status/1849852265441657089,https://x.com/CarrillonavasG/status/1849852265441657089/analytics,https://x.com/CarrillonavasG,"L.G.Carrillo, mi deber con el pueblo",@CarrillonavasG,"Oct 25, 2024",2024-10-25,Replying to @CarrillonavasG,"@CarrillonavasG El Sistema de Monitoreo de Cultivos Ilícitos, @LAPATASOLA1955, muestra que el país cerró el 2023 con 23.000 hectáreas de sembrados de coca más que un año antes, @NicolasBurb @cuajimancho Simci Los datos dejan mal parada la política de Petro contra el narcotráfico L.G.Carrillo, mi deber con el pueblo 🇨🇴 ¡si hay plata para compara cultivos de coca! ¿para que segunda reforma tributaria presidente? Menéndez #MañanasBLU @noeariasr 👈 @Caritotbernal #COP16 Pegasus","@CarrillonavasG El Sistema de Monitoreo de Cultivos Ilícitos, @LAPATASOLA1955, muestra que el país cerró el 2023 con 23.000 hectáreas de sembrados de coca más que un año antes, @NicolasBurb @cuajimancho Simci Los datos dejan mal parada la política de Petro contra el narcotráfico L.G.Carrillo, mi deber con el pueblo 🇨🇴 ¡si hay plata para compara cultivos de coca! ¿para que segunda reforma tributaria presidente? Menéndez #MañanasBLU @noeariasr 👈 @Caritotbernal #COP16 Pegasus","El Sistema de Monitoreo de Cultivos Ilícitos, , muestra que el país cerró el 2023 con 23.000 hectáreas de sembrados de coca más que un año antes, Simci Los datos dejan mal parada la política de Petro contra el narcotráfico L.G.Carrillo, mi deber con el pueblo ¡si hay plata para compara cultivos de coca! ¿para que segunda reforma tributaria presidente? Menéndez MañanasBLU COP16 Pegasus",@Caritotbernal|@CarrillonavasG|@LAPATASOLA1955|@NicolasBurb|@cuajimancho|@noeariasr,#COP16|#MañanasBLU,🇨🇴👈,True,3,5,0,46,2,medium,"col_19,col_32","5,3"
x-2026-02-09.csv,1849470963961733421,https://x.com/elojodiestro/status/1849470963961733421,https://x.com/elojodiestro/status/1849470963961733421/analytics,https://x.com/elojodiestro,El Ojo Diestro,@elojodiestro,"Oct 24, 2024",2024-10-24,Replying to @juanda158392211,@juanda158392211 Según el último informe del la producción de Cocaína aumentó más del 50%... De verdad siguen con esa bobada? Los narcos están es felices con Petro! SIMCI,@juanda158392211 Según el último informe del la producción de Cocaína aumentó más del 50%... De verdad siguen con esa bobada? Los narcos están es felices con Petro! SIMCI,Según el último informe del la producción de Cocaína aumentó más del 50%... De verdad siguen con esa bobada? Los narcos están es felices con Petro! SIMCI,@juanda158392211,,,True,0,0,0,22,0,none,,
x-2026-02-09.csv,1849242676400427037,https://x.com/AlejoRamirezL/status/1849242676400427037,https://x.com/AlejoRamirezL/status/1849242676400427037/analytics,https://x.com/AlejoRamirezL,Alejandro Ramirez,@AlejoRamirezL,"Oct 23, 2024",2024-10-23,,"#ElMartillo Atención Hoy 8 P.M. no se pierdan @ONU_es: analizaremos informe @petrogustavo cultivos ilícitos y Ptca Nac. de drogas SIMCI nos lleva hacia 3 mil toneladas métricas de clorhidrato de cocaína, camino a una de las sociedades más violentas y corruptas de la Reg. Caribe 🚨","#ElMartillo Atención Hoy 8 P.M. no se pierdan @ONU_es: analizaremos informe @petrogustavo cultivos ilícitos y Ptca Nac. de drogas SIMCI nos lleva hacia 3 mil toneladas métricas de clorhidrato de cocaína, camino a una de las sociedades más violentas y corruptas de la Reg. Caribe 🚨","ElMartillo Atención Hoy 8 P.M. no se pierdan : analizaremos informe cultivos ilícitos y Ptca Nac. de drogas SIMCI nos lleva hacia 3 mil toneladas métricas de clorhidrato de cocaína, camino a una de las sociedades más violentas y corruptas de la Reg. Caribe",@ONU_es|@petrogustavo,#ElMartillo,🚨,True,3,4,0,177,2,medium,"col_19,col_31","4,3"
x-2026-02-09.csv,1849120066475794937,https://x.com/elbrunom/status/1849120066475794937,https://x.com/elbrunom/status/1849120066475794937/analytics,https://x.com/elbrunom,Bruno Madrigal,@elbrunom,"Oct 23, 2024",2024-10-23,Replying to @juanda158392211,@juanda158392211 Cero titulares de esto en RTVC y del maltratamujeres @HOLLMANMORRIS Esto solo demuestra que la izquierda y la derecha son la misma Urgente: producción de cocaína pura en Colombia se disparó: de 1.738 toneladas en 2022 pasó a 2.664... 💩 From eltiempo.com,@juanda158392211 Cero titulares de esto en RTVC y del maltratamujeres @HOLLMANMORRIS Esto solo demuestra que la izquierda y la derecha son la misma Urgente: producción de cocaína pura en Colombia se disparó: de 1.738 toneladas en 2022 pasó a 2.664... 💩 From eltiempo.com,Cero titulares de esto en RTVC y del maltratamujeres Esto solo demuestra que la izquierda y la derecha son la misma Urgente: producción de cocaína pura en Colombia se disparó: de 1.738 toneladas en 2022 pasó a 2.664... From eltiempo.com,@HOLLMANMORRIS|@juanda158392211,,💩,False,0,0,0,26,0,none,,
x-2026-02-09.csv,1849060993357283564,https://x.com/maxilofragozo/status/1849060993357283564,https://x.com/maxilofragozo/status/1849060993357283564/analytics,https://x.com/maxilofragozo,Jose Frago𝕏o,@maxilofragozo,"Oct 23, 2024",2024-10-23,,Narco gobierno? Producción de cocaína pura en el gobierno petro.. 1.738 toneladas en 2022. 2.664 toneladas en 2023. 🏁 📚 🦷 🍾,Narco gobierno? Producción de cocaína pura en el gobierno petro.. 1.738 toneladas en 2022. 2.664 toneladas en 2023. 🏁 📚 🦷 🍾,Narco gobierno? Producción de cocaína pura en el gobierno petro.. 1.738 toneladas en 2022. 2.664 toneladas en 2023.,,,🍾🏁📚🦷,False,0,0,0,11,0,none,,
x-2026-02-09.csv,1848889475801174042,https://x.com/betude/status/1848889475801174042,https://x.com/betude/status/1848889475801174042/analytics,https://x.com/betude,arca,@betude,"Oct 22, 2024",2024-10-22,,"#Hora20 La Oficina de la Naciones Unidas contra la Droga y el Delito y el Ministerio de Justicia y del Derecho, presentaron los resultados del Sistema Integrado de Monitoreo de Cultivos Ilícitos, el cual arrojó un incremento del 10% en el área sembrada con coca en el país. SIMCI","#Hora20 La Oficina de la Naciones Unidas contra la Droga y el Delito y el Ministerio de Justicia y del Derecho, presentaron los resultados del Sistema Integrado de Monitoreo de Cultivos Ilícitos, el cual arrojó un incremento del 10% en el área sembrada con coca en el país. SIMCI","Hora20 La Oficina de la Naciones Unidas contra la Droga y el Delito y el Ministerio de Justicia y del Derecho, presentaron los resultados del Sistema Integrado de Monitoreo de Cultivos Ilícitos, el cual arrojó un incremento del 10% en el área sembrada con coca en el país. SIMCI",,#Hora20,,True,1,0,0,8,1,low,col_19,1
x-2026-02-09.csv,1848602258952344000,https://x.com/elojodiestro/status/1848602258952344000,https://x.com/elojodiestro/status/1848602258952344000/analytics,https://x.com/elojodiestro,El Ojo Diestro,@elojodiestro,"Oct 22, 2024",2024-10-22,Replying to @Mamertos0,"@Mamertos0 Será que este señor si leyó el último informe del? Le cuento, la incautación de coca está tan alta, porque la producción llegó a cifras históricas... SIMCI","@Mamertos0 Será que este señor si leyó el último informe del? Le cuento, la incautación de coca está tan alta, porque la producción llegó a cifras históricas... SIMCI","Será que este señor si leyó el último informe del? Le cuento, la incautación de coca está tan alta, porque la producción llegó a cifras históricas... SIMCI",@Mamertos0,,,True,0,0,0,3,0,none,,
x-2026-02-08.csv,1848536279329157589,https://x.com/Enrique_GomezM/status/1848536279329157589,https://x.com/Enrique_GomezM/status/1848536279329157589/analytics,https://x.com/Enrique_GomezM,Enrique Gómez,@Enrique_GomezM,"Oct 21, 2024",2024-10-21,,"Bajo la manida excusa de “diferencias metodológicas de interpretación”, Colombia siempre adoptó el dato, sustancialmente inferior, como reflejo de su derecho a la irrealidad en la definición de su política nacional antidrogas. Simci","Bajo la manida excusa de “diferencias metodológicas de interpretación”, Colombia siempre adoptó el dato, sustancialmente inferior, como reflejo de su derecho a la irrealidad en la definición de su política nacional antidrogas. Simci","Bajo la manida excusa de “diferencias metodológicas de interpretación”, Colombia siempre adoptó el dato, sustancialmente inferior, como reflejo de su derecho a la irrealidad en la definición de su política nacional antidrogas. Simci",,,,True,22,8,0,1500,2,medium,"col_18,col_29","8,22"
x-2026-02-09.csv,1848459538866786332,https://x.com/anibalfds/status/1848459538866786332,https://x.com/anibalfds/status/1848459538866786332/analytics,https://x.com/anibalfds,Aníbal Fernández de Soto,@anibalfds,"Oct 21, 2024",2024-10-21,,@ELTIEMPO “Las cifras del sobre cultivos de coca y producción de cocaína le exigen al Gobierno un nuevo enfoque para atacar el flagelo” Editorial Simci,@ELTIEMPO “Las cifras del sobre cultivos de coca y producción de cocaína le exigen al Gobierno un nuevo enfoque para atacar el flagelo” Editorial Simci,“Las cifras del sobre cultivos de coca y producción de cocaína le exigen al Gobierno un nuevo enfoque para atacar el flagelo” Editorial Simci,@ELTIEMPO,,,True,1,0,0,109,1,low,col_19,1
x-2026-02-09.csv,1848429214221131784,https://x.com/GilbertoCa68721/status/1848429214221131784,https://x.com/GilbertoCa68721/status/1848429214221131784/analytics,https://x.com/GilbertoCa68721,Aquellos60's,@GilbertoCa68721,"Oct 21, 2024",2024-10-21,,Producción de cocaína aumentó 53 por ciento en 2023 en Colombia: informe de la ONU | Cambio Colombia - El más reciente informe del Sistema Integrado de Monitoreo de Cultivos ( ) reveló que el país.. NARICES GRINGAS Y EUROPEAS SN INSACIABLES!! LEY D MERCADOSQuieNlasHizo?USA Simci,Producción de cocaína aumentó 53 por ciento en 2023 en Colombia: informe de la ONU | Cambio Colombia - El más reciente informe del Sistema Integrado de Monitoreo de Cultivos ( ) reveló que el país.. NARICES GRINGAS Y EUROPEAS SN INSACIABLES!! LEY D MERCADOSQuieNlasHizo?USA Simci,Producción de cocaína aumentó 53 por ciento en 2023 en Colombia: informe de la ONU Cambio Colombia - El más reciente informe del Sistema Integrado de Monitoreo de Cultivos ( ) reveló que el país.. NARICES GRINGAS Y EUROPEAS SN INSACIABLES!! LEY D MERCADOSQuieNlasHizo?USA Simci,,,,True,0,0,0,9,0,none,,
x-2026-02-08.csv,1848420737113035131,https://x.com/Enrique_GomezM/status/1848420737113035131,https://x.com/Enrique_GomezM/status/1848420737113035131/analytics,https://x.com/Enrique_GomezM,Enrique Gómez,@Enrique_GomezM,"Oct 21, 2024",2024-10-21,,"La gran conclusión del informe 2023 sobre el aumento de producción de cocaína en Colombia es que las llamadas zonas “concentradas” o “enclaves” productivos de coca, situadas todas en los departamentos con mayor área de siembra (Cauca, Nariño, Putumayo y Norte de Santander) SIMCI","La gran conclusión del informe 2023 sobre el aumento de producción de cocaína en Colombia es que las llamadas zonas “concentradas” o “enclaves” productivos de coca, situadas todas en los departamentos con mayor área de siembra (Cauca, Nariño, Putumayo y Norte de Santander) SIMCI","La gran conclusión del informe 2023 sobre el aumento de producción de cocaína en Colombia es que las llamadas zonas “concentradas” o “enclaves” productivos de coca, situadas todas en los departamentos con mayor área de siembra (Cauca, Nariño, Putumayo y Norte de Santander) SIMCI",,,,True,70,48,3,1900,3,high,"col_18,col_29,col_31","3,48,70"
x-2026-02-09.csv,1848407740206465425,https://x.com/CHATEAUBRIAND15/status/1848407740206465425,https://x.com/CHATEAUBRIAND15/status/1848407740206465425/analytics,https://x.com/CHATEAUBRIAND15,CHATEAUBRIAND,@CHATEAUBRIAND15,"Oct 21, 2024",2024-10-21,,"Urgente: producción de cocaína pura en Colombia se disparó: de 1.738 toneladas en 2022 pasó a 2.664 toneladas en 2023, según informe Simci","Urgente: producción de cocaína pura en Colombia se disparó: de 1.738 toneladas en 2022 pasó a 2.664 toneladas en 2023, según informe Simci","Urgente: producción de cocaína pura en Colombia se disparó: de 1.738 toneladas en 2022 pasó a 2.664 toneladas en 2023, según informe Simci",,,,True,0,0,0,16,0,none,,
x-2026-02-09.csv,1848406435018813792,https://x.com/andresrocruz/status/1848406435018813792,https://x.com/andresrocruz/status/1848406435018813792/analytics,https://x.com/andresrocruz,Andres Robayo Cruz,@andresrocruz,"Oct 21, 2024",2024-10-21,Replying to @Dark_Esquimal,"@Dark_Esquimal Se le olvidó agregar los datos de @DANE_Colombia de los líderes sociales asesinados desde que empezó el gobierno de @petrogustavo, la cifra de masacres, la pérdida de control territorial por parte del estado y la cantidad de hectáreas de droga sembradas según el SIMCI","@Dark_Esquimal Se le olvidó agregar los datos de @DANE_Colombia de los líderes sociales asesinados desde que empezó el gobierno de @petrogustavo, la cifra de masacres, la pérdida de control territorial por parte del estado y la cantidad de hectáreas de droga sembradas según el SIMCI","Se le olvidó agregar los datos de de los líderes sociales asesinados desde que empezó el gobierno de , la cifra de masacres, la pérdida de control territorial por parte del estado y la cantidad de hectáreas de droga sembradas según el SIMCI",@DANE_Colombia|@Dark_Esquimal|@petrogustavo,,,True,0,0,0,9,0,none,,
x-2026-02-09.csv,1848405275788869692,https://x.com/DanielMejiaL/status/1848405275788869692,https://x.com/DanielMejiaL/status/1848405275788869692/analytics,https://x.com/DanielMejiaL,Daniel Mejia,@DanielMejiaL,"Oct 21, 2024",2024-10-21,Replying to @Inolvidable29,@Inolvidable29 Informes de -UNODC y MinDefensa SIMCI,@Inolvidable29 Informes de -UNODC y MinDefensa SIMCI,Informes de -UNODC y MinDefensa SIMCI,@Inolvidable29,,,True,4,1,0,113,2,medium,"col_19,col_31","1,4"
x-2026-02-08.csv,1848377800773845261,https://x.com/Enrique_GomezM/status/1848377800773845261,https://x.com/Enrique_GomezM/status/1848377800773845261/analytics,https://x.com/Enrique_GomezM,Enrique Gómez,@Enrique_GomezM,"Oct 21, 2024",2024-10-21,,"Birmania ‘mon amour’. Increíble pero cierto: el plan de Carlos Castaño y Danilo González de la toma del poder usando la fuerza narco se está materializando: ""La gran conclusión del informe 2023 es que las llamadas zonas “concentradas” o “enclaves” productivos de coca, Simci","Birmania ‘mon amour’. Increíble pero cierto: el plan de Carlos Castaño y Danilo González de la toma del poder usando la fuerza narco se está materializando: ""La gran conclusión del informe 2023 es que las llamadas zonas “concentradas” o “enclaves” productivos de coca, Simci","Birmania ‘mon amour’. Increíble pero cierto: el plan de Carlos Castaño y Danilo González de la toma del poder usando la fuerza narco se está materializando: ""La gran conclusión del informe 2023 es que las llamadas zonas “concentradas” o “enclaves” productivos de coca, Simci",,,,True,74,46,3,1600,3,high,"col_18,col_29,col_31","3,46,74"
x-2026-02-09.csv,1848362377592316186,https://x.com/RadioAmbato1/status/1848362377592316186,https://x.com/RadioAmbato1/status/1848362377592316186/analytics,https://x.com/RadioAmbato1,Radio Ambato,@RadioAmbato1,"Oct 21, 2024",2024-10-21,Replying to @RadioAmbato1,"@RadioAmbato1 será utilizada para la producción de cocaína. El Gobierno de Petro se alista para el comienzo de la Cumbre Mundial de Biodiversidad COP16, se presentó el informe anual del Sistema Integrado de Monitoreo de Cultivos Ilícitos ( ) de Naciones Unidas, que revela que, a 2023, en Simci","@RadioAmbato1 será utilizada para la producción de cocaína. El Gobierno de Petro se alista para el comienzo de la Cumbre Mundial de Biodiversidad COP16, se presentó el informe anual del Sistema Integrado de Monitoreo de Cultivos Ilícitos ( ) de Naciones Unidas, que revela que, a 2023, en Simci","será utilizada para la producción de cocaína. El Gobierno de Petro se alista para el comienzo de la Cumbre Mundial de Biodiversidad COP16, se presentó el informe anual del Sistema Integrado de Monitoreo de Cultivos Ilícitos ( ) de Naciones Unidas, que revela que, a 2023, en Simci",@RadioAmbato1,,,True,1,0,0,17,1,low,col_19,1
x-2026-02-09.csv,1848322530047578272,https://x.com/waldoalarconho1/status/1848322530047578272,https://x.com/waldoalarconho1/status/1848322530047578272/analytics,https://x.com/waldoalarconho1,DESTRUCTOR II De Mamertos.,@waldoalarconho1,"Oct 21, 2024",2024-10-21,,"Córdoba según ONU- UNODC-, tiene la cifra más alta de cultivos de coca que jamás se habían visto en el Departamento, solo el Nudo del Paramillo concentra 12,000 HA y todo el Depto más de 20,000. Estudio que corresponde al 2023 sin incluir 2024. Uno de los logros de Petro. SIMCI","Córdoba según ONU- UNODC-, tiene la cifra más alta de cultivos de coca que jamás se habían visto en el Departamento, solo el Nudo del Paramillo concentra 12,000 HA y todo el Depto más de 20,000. Estudio que corresponde al 2023 sin incluir 2024. Uno de los logros de Petro. SIMCI","Córdoba según ONU- UNODC-, tiene la cifra más alta de cultivos de coca que jamás se habían visto en el Departamento, solo el Nudo del Paramillo concentra 12,000 HA y todo el Depto más de 20,000. Estudio que corresponde al 2023 sin incluir 2024. Uno de los logros de Petro. SIMCI",,,,True,28,21,1,440,3,high,"col_19,col_31,col_32","1,21,28"
x-2026-02-09.csv,1848169989733568612,https://x.com/Analitico797/status/1848169989733568612,https://x.com/Analitico797/status/1848169989733568612/analytics,https://x.com/Analitico797,Néstor Quiroz.,@Analitico797,"Oct 20, 2024",2024-10-20,Replying to @mfcruzv,@mfcruzv Excelente dato estadístico y comparativo junto a los datos del las 256.000 Ha con una producción de 1800 Tn métricas al año. está inundada de SIMCI de coca y una producción elevada y un show demagogo para incautos. 🇨🇴 🍃,@mfcruzv Excelente dato estadístico y comparativo junto a los datos del las 256.000 Ha con una producción de 1800 Tn métricas al año. está inundada de SIMCI de coca y una producción elevada y un show demagogo para incautos. 🇨🇴 🍃,Excelente dato estadístico y comparativo junto a los datos del las 256.000 Ha con una producción de 1800 Tn métricas al año. está inundada de SIMCI de coca y una producción elevada y un show demagogo para incautos.,@mfcruzv,,🇨🇴🍃,True,3,3,0,59,2,medium,"col_19,col_31","3,3"
x-2026-02-09.csv,1848079908981064072,https://x.com/ErnestoLPV/status/1848079908981064072,https://x.com/ErnestoLPV/status/1848079908981064072/analytics,https://x.com/ErnestoLPV,@ErnestoLPV,@ErnestoLPV,"Oct 20, 2024",2024-10-20,,"Urgente: producción de cocaína pura en Colombia se disparó: de 1.738 toneladas en 2022 pasó a 2.664 toneladas en 2023, según informe Urgente: producción de cocaína pura en Colombia se disparó: de 1.738 toneladas en 2022 pasó a 2.664... Simci From eltiempo.com","Urgente: producción de cocaína pura en Colombia se disparó: de 1.738 toneladas en 2022 pasó a 2.664 toneladas en 2023, según informe Urgente: producción de cocaína pura en Colombia se disparó: de 1.738 toneladas en 2022 pasó a 2.664... Simci From eltiempo.com","Urgente: producción de cocaína pura en Colombia se disparó: de 1.738 toneladas en 2022 pasó a 2.664 toneladas en 2023, según informe Urgente: producción de cocaína pura en Colombia se disparó: de 1.738 toneladas en 2022 pasó a 2.664... Simci From eltiempo.com",,,,True,2,2,0,183,2,medium,"col_19,col_31","2,2"
x-2026-02-09.csv,1847917268409209314,https://x.com/Diego50004Spain/status/1847917268409209314,https://x.com/Diego50004Spain/status/1847917268409209314/analytics,https://x.com/Diego50004Spain,Diego Miranda,@Diego50004Spain,"Oct 20, 2024",2024-10-20,,En mi querida Colombia se incrementa un 53% la producción de cocaina llegando a niveles nunca antes vistos 🇨🇴 ⤵,En mi querida Colombia se incrementa un 53% la producción de cocaina llegando a niveles nunca antes vistos 🇨🇴 ⤵,En mi querida Colombia se incrementa un 53% la producción de cocaina llegando a niveles nunca antes vistos ⤵,,,⤵🇨🇴,False,1,0,0,97,1,low,col_19,1
x-2026-02-09.csv,1847915828240367846,https://x.com/puntillazofinal/status/1847915828240367846,https://x.com/puntillazofinal/status/1847915828240367846/analytics,https://x.com/puntillazofinal,Cáustico,@puntillazofinal,"Oct 20, 2024",2024-10-20,,#COP16Cololombia Ojalá los participantes de la no lean el Informe del Sistema Integrado de Monitoreo de Cultivos Ilícitos ( @ONU_es ) de Naciones Unidas donde reportan record de 250mil hectáreas cultivadas en coca.Coca y minería ilegal están acabando con la biodiversidad. Simci,#COP16Cololombia Ojalá los participantes de la no lean el Informe del Sistema Integrado de Monitoreo de Cultivos Ilícitos ( @ONU_es ) de Naciones Unidas donde reportan record de 250mil hectáreas cultivadas en coca.Coca y minería ilegal están acabando con la biodiversidad. Simci,COP16Cololombia Ojalá los participantes de la no lean el Informe del Sistema Integrado de Monitoreo de Cultivos Ilícitos ( ) de Naciones Unidas donde reportan record de 250mil hectáreas cultivadas en coca.Coca y minería ilegal están acabando con la biodiversidad. Simci,@ONU_es,#COP16Cololombia,,True,1,0,0,19,1,low,col_19,1
x-2026-02-09.csv,1847907094101385644,https://x.com/puntillazofinal/status/1847907094101385644,https://x.com/puntillazofinal/status/1847907094101385644/analytics,https://x.com/puntillazofinal,Cáustico,@puntillazofinal,"Oct 20, 2024",2024-10-20,,#COP16 Ojalá los participantes de la no lean el Informe del Sistema Integrado de Monitoreo de Cultivos Ilícitos ( @CMNUCC ) de Naciones Unidas donde reportan el record de 250 mil hectáreas cultivadas en coca.Coca y minería ilegal están acabando con la biodiversidad. @ONU_es Simci,#COP16 Ojalá los participantes de la no lean el Informe del Sistema Integrado de Monitoreo de Cultivos Ilícitos ( @CMNUCC ) de Naciones Unidas donde reportan el record de 250 mil hectáreas cultivadas en coca.Coca y minería ilegal están acabando con la biodiversidad. @ONU_es Simci,COP16 Ojalá los participantes de la no lean el Informe del Sistema Integrado de Monitoreo de Cultivos Ilícitos ( ) de Naciones Unidas donde reportan el record de 250 mil hectáreas cultivadas en coca.Coca y minería ilegal están acabando con la biodiversidad. Simci,@CMNUCC|@ONU_es,#COP16,,True,0,0,0,30,0,none,,
x-2026-02-09.csv,1847771574696313216,https://x.com/Dr_WilGo/status/1847771574696313216,https://x.com/Dr_WilGo/status/1847771574696313216/analytics,https://x.com/Dr_WilGo,WilGo,@Dr_WilGo,"Oct 19, 2024",2024-10-19,Replying to @FernanMartinez,@FernanMartinez Los expertos de la derecha en el informe no saben distinguir entre hoja de coca y cocaína. Y así se las dan de conocedores. Valen... SIMCI,@FernanMartinez Los expertos de la derecha en el informe no saben distinguir entre hoja de coca y cocaína. Y así se las dan de conocedores. Valen... SIMCI,Los expertos de la derecha en el informe no saben distinguir entre hoja de coca y cocaína. Y así se las dan de conocedores. Valen... SIMCI,@FernanMartinez,,,True,0,0,0,6,0,none,,
x-2026-02-09.csv,1847769395440812176,https://x.com/GuidoPatricioN3/status/1847769395440812176,https://x.com/GuidoPatricioN3/status/1847769395440812176/analytics,https://x.com/GuidoPatricioN3,PatricioN3,@GuidoPatricioN3,"Oct 19, 2024",2024-10-19,,"Urgente: producción de cocaína pura en Colombia se disparó: de 1.738 toneladas en 2022 pasó a 2.664 toneladas en 2023, según informe Urgente: producción de cocaína pura en Colombia se disparó: de 1.738 toneladas en 2022 pasó a 2.664... Simci From eltiempo.com","Urgente: producción de cocaína pura en Colombia se disparó: de 1.738 toneladas en 2022 pasó a 2.664 toneladas en 2023, según informe Urgente: producción de cocaína pura en Colombia se disparó: de 1.738 toneladas en 2022 pasó a 2.664... Simci From eltiempo.com","Urgente: producción de cocaína pura en Colombia se disparó: de 1.738 toneladas en 2022 pasó a 2.664 toneladas en 2023, según informe Urgente: producción de cocaína pura en Colombia se disparó: de 1.738 toneladas en 2022 pasó a 2.664... Simci From eltiempo.com",,,,True,0,0,0,8,0,none,,
x-2026-02-09.csv,1847721724579623358,https://x.com/Citadino22/status/1847721724579623358,https://x.com/Citadino22/status/1847721724579623358/analytics,https://x.com/Citadino22,Citadino,@Citadino22,"Oct 19, 2024",2024-10-19,,"Gracias Petrico, te amamos loco desgraciado! 😡","Gracias Petrico, te amamos loco desgraciado! 😡","Gracias Petrico, te amamos loco desgraciado!",,,😡,False,1,0,0,66,1,low,col_19,1
